Age,Name,Surname,Email,DateOfReg,Phone,Time,valid,errors
21,Vasya,Petrov,Vasya@mail.ru,03/07/2015,+375 44 2569845,28:50,false,Неправилное значение часов
$%,Anna,Antonova,Anna@gmail.ru,03/13/2014,+375 44 8541254,10:00,false,Ошибка в поле age. Значение поля '$%' не соответствует заданному формату: [0-9],Ошибка в поле date. Неверный формат даты
1f7,Max,Vasiliev,Max@mail.ru,05.07.2008,+375 29 14521445,11:00,false,Ошибка в поле age. Длина поля не входит в диапазон (2-2),Ошибка в поле age. Значение поля '1f7' не соответствует заданному формату: [0-9],Ошибка в поле phone. Значение поля '+375 29 14521445' не соответствует заданному формату: +375 29/44/25/33 *******
19,Oleg,Kats,Oleg@mail.ru,29-01-2016,+375 28 2540033,22:06,false,Ошибка в поле phone. Значение поля '+375 28 2540033' не соответствует заданному формату: +375 29/44/25/33 *******
20,Pety0a,Grom,Petya@gmail.ru,28-02-2020,+375 25 9658410,18:04,false,Ошибка в поле name. Значение поля 'Pety0a' не соответствует заданному формату: [a-zA-Z],Ошибка в поле date. Значение поля '28.02-2020' не может быть больше сегодняшней даты Sun Nov 11 2018 20:07:47 GMT+0300 (Moscow Standard Time)
11,Elena,Glazov,Elena@mail.ru,24/04/2018,+375 30 2561421,18:04,false,Ошибка в поле phone. Значение поля '+375 30 2561421' не соответствует заданному формату: +375 29/44/25/33 *******
145,Igor,Igorov,Igor@mail.ru,25.00.2018,+375 29 340157,11:40,false,Ошибка в поле age. Длина поля не входит в диапазон (2-2),Ошибка в поле date. Неверный формат даты,Ошибка в поле phone. Значение поля '+375 29 340157' не соответствует заданному формату: +375 29/44/25/33 *******
Age,Name,Surname,Time,regDate,mail,Phone,true,
